{
  "id": "ch7_lv28",
  "chapter": 7,
  "nameJP": "坂の最終試験",
  "nameEN": "Hill Final Exam",
  "timeLimitSec": 80,
  "quota": 34,
  "grid": [
    "####################",
    "#..................#",
    "#.T.....,....,...T.#",
    "#...........,......#",
    "#....,.............#",
    "#.^.^.^.^.^.^.^.^..#",
    "#.v,v.v.v.P.v.v.v..#",
    "#..................#",
    "#.....,.....,......#",
    "#.T,,............B.#",
    "#..................#",
    "####################"
  ],
  "tileLegend": {
    "#": "Wall/Building (blocked)",
    ".": "Path (walkable)",
    ",": "Grass / Slow Tile (walkable)",
    "~": "Water (blocked)",
    "=": "Bridge (walkable)",
    "G": "Gate (interactive obstacle)",
    "B": "Bin (deposit)",
    "P": "Power-up spawn",
    "T": "Shiba hotspot / waypoint",
    "N": "Crowd/NPC (dynamic obstacle spawn)",
    "S": "Shrine marker",
    "^": "Slope up (walkable, rolling-poop uses slope)",
    "v": "Slope down (walkable, rolling-poop uses slope)"
  },
  "playerSpawn": {
    "x": 2,
    "y": 9
  },
  "shibaSpawn": {
    "x": 17,
    "y": 2
  },
  "bins": [
    {
      "x": 17,
      "y": 9
    }
  ],
  "hotspots": [
    {
      "x": 2,
      "y": 2
    },
    {
      "x": 17,
      "y": 2
    },
    {
      "x": 2,
      "y": 9
    },
    {
      "x": 17,
      "y": 9
    },
    {
      "x": 10,
      "y": 6
    },
    {
      "x": 10,
      "y": 2
    },
    {
      "x": 10,
      "y": 9
    }
  ],
  "poopRules": {
    "spawnIntervalSec": 1.0,
    "maxActive": 60,
    "freshWindowSec": 6,
    "types": {
      "normal": 0.66,
      "golden": 0.064,
      "waterlogged": 0.064,
      "sticky": 0.085,
      "explosive": 0.064,
      "rolling": 0.064
    }
  },
  "shibaRules": {
    "baseSpeedTilesPerSec": 2.85,
    "zoomiesChancePerSec": 0.34,
    "zoomiesDurationSec": 3.2,
    "poopPauseSec": 0.4
  },
  "powerUps": [
    "speed_boost",
    "poop_magnet",
    "no_stink",
    "deodor_spray"
  ],
  "notes": null
}