{
  "id": "ch6_lv22",
  "chapter": 6,
  "nameJP": "横断歩道タイミング",
  "nameEN": "Crosswalk Timing",
  "timeLimitSec": 75,
  "quota": 23,
  "grid": [
    "####################",
    "#..................#",
    "#.TN.............T.#",
    "#........N#.N......#",
    "#....N....#........#",
    "#..................#",
    "#.........P........#",
    "#.........#........#",
    "#..N...............#",
    "#.T.......#......B.#",
    "#..................#",
    "####################"
  ],
  "tileLegend": {
    "#": "Wall/Building (blocked)",
    ".": "Path (walkable)",
    ",": "Grass / Slow Tile (walkable)",
    "~": "Water (blocked)",
    "=": "Bridge (walkable)",
    "G": "Gate (interactive obstacle)",
    "B": "Bin (deposit)",
    "P": "Power-up spawn",
    "T": "Shiba hotspot / waypoint",
    "N": "Crowd/NPC (dynamic obstacle spawn)",
    "S": "Shrine marker",
    "^": "Slope up (walkable, rolling-poop uses slope)",
    "v": "Slope down (walkable, rolling-poop uses slope)"
  },
  "playerSpawn": {
    "x": 2,
    "y": 9
  },
  "shibaSpawn": {
    "x": 17,
    "y": 2
  },
  "bins": [
    {
      "x": 17,
      "y": 9
    }
  ],
  "hotspots": [
    {
      "x": 2,
      "y": 2
    },
    {
      "x": 17,
      "y": 2
    },
    {
      "x": 2,
      "y": 9
    },
    {
      "x": 17,
      "y": 9
    },
    {
      "x": 10,
      "y": 6
    },
    {
      "x": 10,
      "y": 2
    },
    {
      "x": 10,
      "y": 9
    }
  ],
  "poopRules": {
    "spawnIntervalSec": 1.3,
    "maxActive": 55,
    "freshWindowSec": 6,
    "types": {
      "normal": 0.723,
      "golden": 0.064,
      "waterlogged": 0.064,
      "sticky": 0.085,
      "explosive": 0.064
    }
  },
  "shibaRules": {
    "baseSpeedTilesPerSec": 2.7,
    "zoomiesChancePerSec": 0.25,
    "zoomiesDurationSec": 3.0,
    "poopPauseSec": 0.4
  },
  "powerUps": [
    "speed_boost",
    "poop_magnet",
    "time_freeze"
  ],
  "notes": null
}