{
  "id": "ch4_lv16",
  "chapter": 4,
  "nameJP": "ねばねば解禁",
  "nameEN": "Sticky Situation",
  "timeLimitSec": 70,
  "quota": 24,
  "grid": [
    "####################",
    "#.........G........#",
    "#.T.N..........N.T.#",
    "#.....N..........N.#",
    "#..#..#..#..#..#...#",
    "#..................#",
    "#.........P....N...#",
    "#..#..#..#..#..#...#",
    "#..................#",
    "#.T......N.N.....B.#",
    "#..................#",
    "####################"
  ],
  "tileLegend": {
    "#": "Wall/Building (blocked)",
    ".": "Path (walkable)",
    ",": "Grass / Slow Tile (walkable)",
    "~": "Water (blocked)",
    "=": "Bridge (walkable)",
    "G": "Gate (interactive obstacle)",
    "B": "Bin (deposit)",
    "P": "Power-up spawn",
    "T": "Shiba hotspot / waypoint",
    "N": "Crowd/NPC (dynamic obstacle spawn)",
    "S": "Shrine marker",
    "^": "Slope up (walkable, rolling-poop uses slope)",
    "v": "Slope down (walkable, rolling-poop uses slope)"
  },
  "playerSpawn": {
    "x": 2,
    "y": 9
  },
  "shibaSpawn": {
    "x": 17,
    "y": 2
  },
  "bins": [
    {
      "x": 17,
      "y": 9
    }
  ],
  "hotspots": [
    {
      "x": 2,
      "y": 2
    },
    {
      "x": 17,
      "y": 2
    },
    {
      "x": 2,
      "y": 9
    },
    {
      "x": 17,
      "y": 9
    },
    {
      "x": 10,
      "y": 6
    },
    {
      "x": 10,
      "y": 2
    },
    {
      "x": 10,
      "y": 9
    }
  ],
  "poopRules": {
    "spawnIntervalSec": 1.4,
    "maxActive": 45,
    "freshWindowSec": 6,
    "types": {
      "normal": 0.787,
      "golden": 0.064,
      "waterlogged": 0.064,
      "sticky": 0.085
    }
  },
  "shibaRules": {
    "baseSpeedTilesPerSec": 2.4,
    "zoomiesChancePerSec": 0.22,
    "zoomiesDurationSec": 2.6,
    "poopPauseSec": 0.5
  },
  "powerUps": [
    "speed_boost",
    "poop_magnet",
    "coin_shower"
  ],
  "notes": "First appearance of Sticky poop in meaningful quantity."
}