{
  "id": "ch8_lv30",
  "chapter": 8,
  "nameJP": "大うんち決戦",
  "nameEN": "The Great Pile Showdown",
  "timeLimitSec": 90,
  "quota": 1,
  "grid": [
    "####################",
    "#..................#",
    "#.T..............T.#",
    "#..#######.######..#",
    "#..#......S.....#..#",
    "#..#............#..#",
    "#..#......P.....#..#",
    "#..#............#..#",
    "#..#######.######..#",
    "#.T..............B.#",
    "#..................#",
    "####################"
  ],
  "tileLegend": {
    "#": "Wall/Building (blocked)",
    ".": "Path (walkable)",
    ",": "Grass / Slow Tile (walkable)",
    "~": "Water (blocked)",
    "=": "Bridge (walkable)",
    "G": "Gate (interactive obstacle)",
    "B": "Bin (deposit)",
    "P": "Power-up spawn",
    "T": "Shiba hotspot / waypoint",
    "N": "Crowd/NPC (dynamic obstacle spawn)",
    "S": "Shrine marker",
    "^": "Slope up (walkable, rolling-poop uses slope)",
    "v": "Slope down (walkable, rolling-poop uses slope)"
  },
  "playerSpawn": {
    "x": 2,
    "y": 9
  },
  "shibaSpawn": {
    "x": 17,
    "y": 2
  },
  "bins": [
    {
      "x": 17,
      "y": 9
    }
  ],
  "hotspots": [
    {
      "x": 2,
      "y": 2
    },
    {
      "x": 17,
      "y": 2
    },
    {
      "x": 2,
      "y": 9
    },
    {
      "x": 17,
      "y": 9
    },
    {
      "x": 10,
      "y": 6
    },
    {
      "x": 10,
      "y": 2
    },
    {
      "x": 10,
      "y": 9
    }
  ],
  "poopRules": {
    "spawnIntervalSec": 1.0,
    "maxActive": 65,
    "freshWindowSec": 6,
    "types": {
      "normal": 0.574,
      "golden": 0.064,
      "waterlogged": 0.064,
      "sticky": 0.085,
      "explosive": 0.064,
      "rolling": 0.064,
      "cursed": 0.085
    }
  },
  "shibaRules": {
    "baseSpeedTilesPerSec": 3.0,
    "zoomiesChancePerSec": 0.3,
    "zoomiesDurationSec": 3.4,
    "poopPauseSec": 0.4
  },
  "powerUps": [
    "speed_boost",
    "poop_magnet",
    "no_stink",
    "time_freeze",
    "deodor_spray"
  ],
  "notes": "Boss placeholder: treat quota as 'defeat big pile' and ignore normal quota."
}