{
  "id": "ch3_lv11",
  "chapter": 3,
  "nameJP": "砂の模様に注意",
  "nameEN": "Respect the Raked Sand",
  "timeLimitSec": 70,
  "quota": 19,
  "grid": [
    "####################",
    "#,,,,,,,,,,,,,,,,,,#",
    "#,B..............B,#",
    "#,................,#",
    "#,....,,,,,,,,....,#",
    "#,....,,,,,,,,....,#",
    "#,....,,,,P,,,....,#",
    "#,....,,,,,,,,....,#",
    "#,................,#",
    "#,T...............,#",
    "#,,,,,,,,,,,,,,,,,,#",
    "####################"
  ],
  "tileLegend": {
    "#": "Wall/Building (blocked)",
    ".": "Path (walkable)",
    ",": "Grass / Slow Tile (walkable)",
    "~": "Water (blocked)",
    "=": "Bridge (walkable)",
    "G": "Gate (interactive obstacle)",
    "B": "Bin (deposit)",
    "P": "Power-up spawn",
    "T": "Shiba hotspot / waypoint",
    "N": "Crowd/NPC (dynamic obstacle spawn)",
    "S": "Shrine marker",
    "^": "Slope up (walkable, rolling-poop uses slope)",
    "v": "Slope down (walkable, rolling-poop uses slope)"
  },
  "playerSpawn": {
    "x": 2,
    "y": 9
  },
  "shibaSpawn": {
    "x": 17,
    "y": 2
  },
  "bins": [
    {
      "x": 2,
      "y": 2
    },
    {
      "x": 17,
      "y": 2
    }
  ],
  "hotspots": [
    {
      "x": 2,
      "y": 2
    },
    {
      "x": 17,
      "y": 2
    },
    {
      "x": 2,
      "y": 9
    },
    {
      "x": 17,
      "y": 9
    },
    {
      "x": 10,
      "y": 6
    },
    {
      "x": 10,
      "y": 2
    },
    {
      "x": 10,
      "y": 9
    }
  ],
  "poopRules": {
    "spawnIntervalSec": 1.7,
    "maxActive": 40,
    "freshWindowSec": 6,
    "types": {
      "normal": 0.872,
      "golden": 0.064,
      "waterlogged": 0.064
    }
  },
  "shibaRules": {
    "baseSpeedTilesPerSec": 2.25,
    "zoomiesChancePerSec": 0.16,
    "zoomiesDurationSec": 2.4,
    "poopPauseSec": 0.5
  },
  "powerUps": [
    "speed_boost",
    "poop_magnet",
    "deodor_spray"
  ],
  "notes": null
}